,title,verdict
58,The difference between new and old padding in bus seats,1
310,"me n my friend have vry sexual convos (will mention the topics, nothing specific cause minor lol)",1
207,Went for a dentist appointment for some pain after some fillings I had done this year... apparently I have some extra teeth. That may also be doing it.,1
283,Why did I text someone again?,1
211,GUYS WE HAVE AN ACE CHARACTER AND HES A POC 🎉🎉🎉🎉🎉,1
3,Diddy cosplaying as Joker and running into Tyler the Creator.,1
204,The gradient of tomatoes from our last harvest before the frost,1
86,I went for a walk at an old ski hill and found the abandoned snow-maker machines,1
9,Monkey pattern stitched into this comforter.,1
175,The lid to my coffee maker looks like Darth Vader’s helmet,1
194,A cardboard six pack holder from a major beverage manufacturer,1
148,Ladybug in chrysanthemum.,1
58,I haven't taken the protective cover of my Ipad since I bought it 10+ years ago and it left a print,1
256,Anyone get through this cases? How do u feel and react?,1
294,"A Long Time Ago, Software Languages Were Loaded On UPS Devices via Interchangeable Chips",1
119,the last time i step there,1
103,My first love is one sided,1
291,This dog's fur trimmed to look like a perfect sphere,1
229,This is what happens when you pickle garlic.,1
166,"if you arrange the 1 - 50 pence coins like this, it makes a shield",1
51,The shape a drop of sauce made on the butter in my curry.,1
117,Incredible spelling error on a large sign.,1
300,My BF is really complicated..,1
252,(OC) Teaching my 7 y/o niece (bottom) to draw,1
25,How to deal with/understand childhood rejection?,1
237,Found this mashroom on the way,1
168,Found a tree that absorbed a fence on my walk.,1
230,I eat a pack of oreos every other day,1
230,Picked up my new mouth guard from the dentist and they included a 3D print of my teeth,1
217,two Jaw Busters one package,1
36,This long-ass worm in my driveway,1
52,There is a fighter jet outside of my apartment today,1
118,weird Fluttershy plush I saw in the store today,1
158,The Charlie Brown Halloween Special had its soundtrack record in the shape of a pumpkin,1
264,"Walked past someone's collection of BMWs, all the same colour",1
44,I really want to send this to her so I put it here instead,1
289,I found conjoined match sticks,1
25,This bar dressed up as Moe’s for Halloween,1
315,I hope I don't love you,1
14,I still have Nintendo playing cards from before they had consoles,1
267,The shower in my hotel room had various soap dispensers.,1
2,"AITA for letting my girlfriend ""cheat""",1
172,This callus on my thumb peeled up and looks like a hummingbird,1
183,The number of water bottles saved at DEN,1
151,"""can I have a pet, please?""",1
221,"Found this plant that grows berries in different shades of green, blue and purple. Apparently they're called 'porcelain berries'.",1
133,Mushrooms growing out of this pinecone,1
135,McCain Mocha,1
139,Pudding looking very boopable,1
299,Real olive tree at my local restaurant,1
181,"Bought the cookies on the same time, but they have two different descriptions and slightly changed boxes.",1
273,There was another can inside of my can,1
140,This half and half apple,1
247,These little quail eggs are expensive!,1
153,This place is selling fork handles for four candles,1
119,I ordered mussels and one of them had a small crab inside,1
144,The variety of eggs in this carton has me stumped on where to start.,1
79,glow in the dark flashlight,1
271,Isn't that your thing?,1
191,went all the way after dating for 3 months,1
63,A curious friend (OC),1
5,I opened a random bag while in a movie prop truck and found a ton of fake cash.,1
147,Broken window resolution,1
45,Local garage has courtesy bikes as well as courtesy cars,1
243,This pepper plant has two leaves that grew fused together.,1
83,This is why,1
105,Two identical products of Bi-carb soda - one in plastic more than twice as expensive per gram.,1
33,A letter to my mother.,1
62,The tip of this spiky plant glows bright red when backlit,1
221,Fly's 'tongue' frozen like Christmas Story,1
32,This smiley chair at a local indonesian restaurant,1
83,My egg cracked while boiling.,1
223,"opened a bag of skittles and only got red, green, and purple colours",1
121,"Two trees growing together, with a twist.",1
43,Hot Pocket without the Hot Pocket?,1
287,i used to say the n word often,1
72,My fan came with a hair-tie.,1
203,This tree with a streak of red leaves,1
85,expections in relationships,1
250,Was anyone else groomed on kik?,1
278,Finding a job,1
196,Quintuple toothbrush reflection,1
252,"Bird poop caterpillar. (Papilo cresphontes)Found munching on my lime tree. Apparently these become the giant swallowtail butterfly, the largest in the US.",1
156,Having the time of Life with Besties is pretty boring!,1
10,"""Woman, Life, Freedom"" graffiti with rouge, a bus stop in Iran",1
71,BIRD OF THE DAY (Halloween Edition): Common Raven (OC),1
204,"A guy asked me out a couple days ago, he had no interest in me in high school",1
214,This pear looks like an apple,1
29,"My dominoes hand was 4, 5, 6, 7, 8, 9, 10.",1
107,"This heart-shaped bread, that our local bakery started selling.",1
133,Sticks and stones case,1
189,Am I in the wrong here?,1
135,Got pregnant with an IUD(birth control in my arm) Needing others perspectives,1
64,Fatty Catty,1
94,The fall colours on these trees in my backyard match the difference in colour on the fence.,1
226,Xmas stuff is already up at my local Walgreens,1
140,A short roller-coaster of someone finding out who they are,1
13,Shadow on my porch looks like the Fellowship of the Ring.,1
46,This street sign in Australia is so long it needs a support post.,1
117,The way these plants are growing from my dogs old rope,1
257,the back of a new record i bought has instructions on how to make a molotov in Italian.,1
114,The last bite of my pizza crust looks like Massachusetts (the sauce is boston).,1
208,I got a quadruple fortune cookie.,1
237,supporting...,1
250,Urinal in a stall,1
55,my friends hand compared to a giant leaf he found,1
51,I found a $100 movie prop bill on the ground today.,1
127,I caught my cat doing The Rock eyebrow meme today:,1
136,The transitioning colors of this tree in Wisconsin,1
36,This giant telephone on my city,1
162,A single different logo in a 6pack of ginger ale,1
73,"Afroman stopped by my friends vintage clothing store, and their ring light looks like a halo above his head",1
218,This spider in my house has a skull on its abdomen,1
292,found this small crab inside while eating mussels,1
200,Mint turned purple,1
239,My dill pickle chip has a happy face,1
84,"This mannequin arm is loose, looks kinda spooky",1
179,Orange milk- it taste like a liquid creamsicle,1
269,This sassy skeleton I got in a bag from the dollar store. All the others were normal poses you would expect.,1
32,I refuse to eat asparagus because it makes my pee smell weird,1
227,a cracked golf ball,1
24,why/how do so many people find dream ugly?,1
234,This really close rainbow,1
169,A spider made a nest inside a fake spider in my Halloween Graveyard.,1
37,A Question.,1
254,my 3rd toe is longer than my big toe,1
243,this weirdly smooth egg-shaped piece of popcorn,1
211,Do bad people deserve happiness?,1
30,double cheeseburger except the second patty is a giant cheese curd,1
71,"some of my chin hairs suddenly grew white then black again? one was completely white. I'm 23, not particularly stressed and no family history of early graying.",1
39,Half rusty push pin,1
3,This park roped off the bees to protect them,1
225,when I put on my new vans one hole wasn't punched through,1
230,This ice cube tray has been missing for a week.,1
213,This Cape Sparrow is a messy eater (OC),1
246,A UK voice in the crowd,1
183,They're filming a Christmas movie in our small town.,1
329,Friend’s Dog,1
201,I found Pac-man in a piece of wood,1
338,Kids of divorced parents had it better,1
47,This Jerky package includes a free flosser,1
31,My wife cracked an egg in water and an air bubble got trapped.,1
55,This one vein in my cats ear.,1
109,Taught my boy how to awoooo,1
255,My uni replaced all bathroom faucets over the holidays. You have to TURN them but students won't get it before all of them break.,1
192,Found a wallet while hunting and that had been lost for two years.,1
53,This factory pipe displays temperature like a thermometer,1
13,Duck staring at camera with feet crossed.,1
43,💜,1
278,Cats will be cats,1
186,Running with the cart,1
21,I got 4 pounds of pecans from a tree in my back yard.,1
54,Im obsessed with the people in my dreams,1
121,Do you wish to see the future? why?,1
68,My neighbor imprinted his driveway with palm tree fronds,1
120,This Megatron themed GTR,1
292,Broom recharging station...,1
90,the thumb prints on my cup,1
39,Liu Kang playing Mortal Kombat,1
80,The number on my coworker's locker was installed upside down,1
67,Rain drops caught in a spiderweb in my garden,1
139,This 4-pack of batteries that includes a 16GB SD card.,1
89,My cat ran into bed [OC],1
48,This Candy looks like the Ukraine flag,1
135,This is an acceptable infestation,1
154,High School Friend of 25 years,1
159,The way I ripped this Truly box made it look like a hachet,1
99,reflection and self-worship??,1
2,Weatherman discovers his monitor has a touch screen. immediately turns into a kid,1
232,3 eggs this morning from the same box,1
80,Natural anthill,1
180,This holey orange,1
182,This lid I peeled off my yoghurt was perfectly clean,1
86,My takeout container had a built-in spot for a smaller container of sauce AND grooves for my thumb for easier one-handed carrying,1
22,College curly hair,1
52,"Say ""hello"" (OC) 😂",1
187,Lady on billboard appears to have hair,1
219,This piece of candy looks oddly Phallic,1
126,(OC) Some spookiness I've seen lately,1
35,The granite on this sink looks like someone just barfed in it,1
95,Triple wrapped water bottle,1
31,My cats shadow in the curtain looks like a guy with a boner lol [NSFW],1
14,"My crush spooned me, she has a girlfriend, and still probably thinks its completely platonic",1
195,This possibly sentient tortilla...,1
68,This huge ant that appeared in my house,1
185,I had a pedicure with gelatin in the water,1
270,This is how you get people's attention - the 5 seconds at the end had me,1
93,My 1999 GMC Yukon SLT bought it a week ago with only 43k miles. Nearly perfect condtion.,1
258,This Medicine that was made by my Great Great Grandfather in 1924,1
40,Gun safety rules on the inside of a bathroom stall at my local shooting range,1
211,This little popsicle was the last one in the box,1
144,Save this planet,1
101,One of my egg yolks had its first cell division.,1
211,Caterpillar on my bike tire when I came out of the grocery,1
149,These methroglyphics at the local Sheetz bathroom,1
284,Kroger discounted this product by one penny and made a deal out of it.,1
1,My dads beer fridge,1
100,This apple is pretty big,1
74,Carrot thumb,1
391,Not sure this even belongs here but here we go I guess,1
356,I only make friends with women who I find disgusting and repulsive,1
178,Living with a housemate I have a crush on,1
259,The way grass stuck to this spiderweb on my front door after mowing.,1
193,"Don’t know if this is the right sub for this. But they didn’t spell it “oops”, instead it’s“opps”.",1
49,This group of sawfly larvae on this branch I saw while bush walking,1
165,The college i attend has very straight bananas,1
289,Reddit🥰,1
337,I am 29 years old and still have never lived independently,1
263,My apple has a belly button,1
113,I found a question mark skittle inside of my pack,1
144,ID picture day at school,1
107,Giant Peacock,1
132,something i just realized,1
118,"This newly built business hotel in Yokosuka, Japan uses room lights to advertise its grand opening date",1
9,What it looks like when it takes you 30 minutes to realize that you accidentally made contact with 35% hydrogen peroxide.,1
171,"I have linear melanonychia, which causes dark vertical lines on my nails (see comments for explanation)",1
370,I Need Some Advice,1
197,These bean seeds sprouting within a yellow bean pod that's been forgotten in the garden,1
160,Perrito bailando!,1
281,Jalapeño cut in the middle of turning red,1
170,I found this counterfeit $100 bill in an air return while having construction done on our home yesterday,1
272,"i love my boyfriend, but i also think i still love my ex",1
103,This is where the auto shutoff tripped when the tank filled up ($6.09/gal),1
160,A letter to my situationship,1
111,"Mom planted this fern outside about a decade ago, now it’s breaking in through the ceiling.",1
168,My future track star (OC),1
79,A seed on this strawberry started sprouting.,1
85,idh how I feel about this..,1
219,a relative's question,1
75,moving on,1
192,"A battery pack in my local bookstore that was made in 2011, expired in 2018, and has never sold.",1
227,This fried egg that looks like a chicken,1
191,"When the war started, a massive flow of Ukrainians started coming to Poland. So my dad decided to transport a ""few"" things to shelters, and this is how our car looked [OC]",1
4,These two grapes grew together on a single stem,1
177,Plane chase in Nevada,1
155,"a 'dolled up' car I saw in Columbus, Ohio today.",1
251,a spider got inside the screen at the gas station,1
62,A beaver is chewing down this tree in my brother's yard.,1
23,Grammar is important,1
272,Younger Grandson and I at Christmas. (OC),1
210,"This alcoholic infused icy place is playing Simpsons in the background (Specifically, the original Treehouse of Horror)",1
213,The drawing my husband did as part of our son's birthday gift.,1
61,This sago has been “dead” for 2 years.,1
271,Piet Mondrian artwork displayed upside down for 75 years,1
31,"From a family of alcoholics, I made a decision",1
124,I am a 24 y.o. high school graduate,1
290,Nadine chomping on my hand,1
99,This trash can that allows you to easily sweep into,1
75,Be together forever.,1
189,This dumpling made my brain commit pareidolia,1
188,"Making more sales, costs went up, but I have a smaller restocking budget.",1
112,I found an LP at work with mechanical keyboard sounds on it,1
65,TW: Talking about s/h,1
207,The way my destroyed extension cord landed,1
29,"The baby wants to sleep on the dog's lap, not his father's",1
109,Custom Old Rip Van Winkle bottle from 1987,1
77,Mutated pear,1
86,i just had to tell someone how im feeling so here's to that,1
369,Every day I'm closer to the end,1
169,It may have taken me 30 years but tonight? Tonight imma be *THAT* house. 😀,1
114,Jimmy Fallon,1
65,This abandoned robins’ nest sprouted its own little garden.,1
254,Almost complete,1
102,How long is too long?,1
366,today i deleted my abuser's photos and messages,1
254,Blew air out of my nose looking at a post on here and this flew out of my nose.,1
63,Sweet potato has a quarter white potato through it!,1
247,5 summers of living on the other side of the fence from the 1st green,1
144,I found half of a Starburst,1
296,"The Reptile Zoo in Monroe, WA has a two-headed turtle named Pete and Repete.",1
63,Being home,1
238,Opened a package at work and found a bunch of these cards inside,1
385,Part 2/update of I’m ghosting the only only friend I have in this state,1
161,This pasta package from Italy,1
274,Moving out didn't help my mental health as much as expected and I'm not sure how to feel about it,1
99,My puffed bag of chips on a flight,1
2,Ice Cream cap Elephant,1
267,you would have made my life better.,1
94,One year,1
133,I step on the scale and see I weigh what a lot of women want to weigh,1
282,How to celebrate my birthday with no friends?,1
241,My friends ID photo is burned into the plastic on his wallet,1
35,"This chipmunk standing in a Disney pose, arms crossed after running off a squirrel from his seeder feeder",1
260,My old cat matches my new countertops. I believe she uses the box as a counter measure.,1
41,My laundry’s shadow looks like a person’s silhouette,1
286,My winter tires have little Michelin men on the side,1
32,Meteorologist getting fed on live TV,1
159,"(Giò Simeone to Sky sport) ""Did you know that only two Argentines scored four goals in the first four Champions games, one is you, the other one do you know who he is?"" ""Eh boh, Lavezzi?"" ""Your Dad, Simeone!"" ""Dad, really? Well, it's a family thing then!""",1
95,I’ve been dealing with severe agoraphobia and an intense fear of hospitals for over a year. Today I went to the hospital to meet my newborn nephew.,1
152,Outtakes of Robin Williams on Sesame Street,1
100,[oc] usually I sell my work however my daughter begged and it cost a hug.,1
137,Cashew showing off her tricks,1
290,The shadows from the guard rail look like tire tracks.,1
138,conditional love,1
288,Drinking fountain can fill water bottles too,1
131,A clock made of clocks in San Jose airport,1
199,Cool rainbow,1
213,Bonker hedgehog cactus in the Munds Mountain Wilderness,1
42,Weird Halloween inflatable spider decoration,1
169,this picture of my pufferfish has a bubble that looks like him in the background,1
171,I don't know if the world would be better or worst without the concept of justice.,1
268,partying with friend,1
16,your inner kid seeing your future you...,1
74,Man with Parkinson's tries marijuana for the first time,1
102,Fall foliage gradient of this tree,1
176,This U-turn light,1
263,"Going through more donation bags, found this alphabet zipper",1
108,I programmed myself to associate Danisnotonfire with the word love when I was a teenager,1
235,artwork on the trees in my local park,1
313,Can my manager be forcing me to go into work like this?,1
154,This lane has eight white cars in a row,1
59,Boy dresses up as a smoke detector,1
241,"The difference between this steamed fall garland and crumpled, fresh out of the package",1
167,This weirdly deformed Kit-Kat,1
218,Planning maging kawatan joke,1
94,My friend got behind a truck carrying a hot air balloon basket.,1
163,This water stain I saw at school kind of looks like delicate arch,1
50,This piece of popcorn that looks like my girlfriend’s cat.,1
43,Found two old watches with flat batteries when moving house. They had stopped while showing nearly the same time.,1
172,Got any plans this weekend?,1
309,Should I Tell Her ?,1
137,Am I the only one who's noticing this?,1
137,crush made me kiss ass,1
37,the television,1
208,Pepsi's bottle cap,1
229,Should I Still Be Upset?,1
38,Me while visiting with my wife's grandparents,1
216,Say what again?!,1
175,NSFW ADVICE NEEDED.,1
156,This random black spot on our kitchen table looks like a very detailed pencil drawing of an eye.,1
7,A spider holding a sun,1
139,Swift as a coursing river,1
85,The paperclip securing my paperwork from the podiatrist is a little foot,1
255,Walking down the street,1
10,I made an Ender Dragon piñata,1
236,"Bought a cheese spread and there were two cover lids, unnoticed until I tried to open",1
152,AAAAAAAAAAAAAHHHHHHHH!!!!!!!!,1
38,There's a dinosaur inside this lamp at Chick-fil-A,1
277,An open letter to my dad.,1
283,A pumpkin I bought had a seed sprouted inside,1
205,Shoes that have been worn for 7 years vs brand new ones,1
244,I found this opened McDonald's kiosk during my trip in Netherland,1
260,"privacy, please!",1
95,Otoliths from two large freshwater drum I caught in July at Lake Erie,1
267,I found another onion inside of my onion,1
127,I think I like someone and I don't know how to react,1
198,A bug got stuck in my bar of soap.,1
25,Forgot to take out one of the pots I was keeping in the oven and it turned the handle green,1
222,My sleepy doodle,1
265,Bought a Skittles flavored vape. Turned out to be Shittles.,1
70,I think my boyfriend's' baby sister' is his daughter with his ex,1
59,This smeared bird poop looks like an owl.,1
218,Local state forest has a bicycle repair station at the trailhead,1
274,My Chicken laid a Round Egg,1
69,"Lebanon (PA) Daily News, 1956",1
142,Activities and assery,1
170,This huge chinese vase,1
37,Found these tilted trees in a forest pathway,1
124,"This movie I'm streaming has a ""for screening only"" logo across it",1
16,Development of nation and rich people here in Nepal,1
142,These beers I bought with resealable caps.,1
200,"I shattered my moral code, but I still feel like I've done the right thing",1
150,The way the colors change on this branch,1
73,These Siamese twins cucumbers.,1
29,this cool leaf mutation I found while walking my cat,1
136,This place I am staying at has a light green toilet bowl,1
247,Lil Pump (OC),1
147,my coworker holding a piece of glass,1
135,I saw an exposed waterpipe that looks like a soft ice cream,1
122,The toilet in my local church community centre is twinned with a toilet in Afghanistan,1
69,Never thought I’d see this in my life,1
19,My drink came with a lemon slice in the (sealed) bottle.,1
51,Family guy song performed live,1
110,This plate my grandmother has in her house.,1
203,(OC) Traditional milkman old-school bottles,1
224,"Metallica, circa 1983",1
129,Iam asexual,1
45,"The bay of Cherbourg, turbulent sea on one side, calm water on the other",1
246,The concrete at my new subway station is made to look like wood,1
65,Is this mix good enough to release?,1
264,I Found This Caterpillar In My Green Beans Tonight,1
106,The comment,1
291,This sticker of a tooth has teeth.,1
217,I wish guys were more content with the person theyre dating.,1
104,All of my credit cards have slightly different chip designs,1
174,Mazda Miata BALLS Edition,1
7,This 1959 Dostojevskij book has never been read. There was a time where you had to put open the pages.,1
103,My new monitor has a ruler below it,1
371,“I-I-I-I” :/,1
172,dudes be like three thrusts in,1
157,"My local Homeplus (Korea) has a 35 million won bottle of whisky (24,290 USD)",1
36,Dad paints Peter Pan flying over kid's bedroom.,1
223,I am a great liar.,1
177,Flat sink that drains without a bowl,1
111,half of my pack of orange waters had the last letter missing only on the front side,1
17,The leaves in this tree turning red from right to left,1
155,lil man is mobile!,1
298,I put a marshmallow in hot coco and it melted like this,1
232,I bought a birthday card and it came with a guide for writing a good card,1
272,Tree growing inside dead tree at monticello.,1
4,This cloud pattern in a photo from my trip to Belgium.,1
44,Wet bouncy house foams,1
288,i am the only single person i know,1
164,"The hotel I'm staying at in Mexico has a ""perfect match"" guide for positions with Sico products",1
224,My Cheese-Its came out in Tetris shapes,1
178,Our Shark vacuum found a spot the exact size as itself to get stuck in.,1
257,What I wish I had said to my ex-wife.,1
15,There was 1 yuan in the cash register at work (Canada),1
302,"My boyfriend claims to be ""hood"" or ""street""",1
206,This bent milk-bone,1
248,School threw out several printers and projectors. All work and are worth about 1k - 300,1
105,Bald Headed Pigeon,1
294,Aita for telling in my brother?,1
33,I spotted this British shop in NYC today. didn't think anything like this existed.,1
179,Falling for My New Roommate,1
207,"The girl that changed my life, please read this!",1
114,Found a good leaf,1
116,This tree is using camouflage despite being the actual tree.,1
40,One of the buildings at my university has a wall where you can draw and post a picture of Danny DeVito,1
196,How to repair your loud computer in less than 10 seconds!,1
204,Opened my water during a flight and when we landed the air pressure on the ground crushed the bottle,1
5,This TV remote in my hotel in Mexico has a dedicated Fútbol button.,1
293,Life imitates art (OC),1
256,The pendant that took me a lot of time to make (OC),1
188,Dealing with stress,1
42,This glass that broke in the shape of a heart,1
133,Big Greg,1
282,spongebob looking a little weird today…,1
97,Will girls always choose a dude in the end?,1
170,I'm not rude or uppity. I just don't have anything to day. That's all.,1
330,My husband used to work 134 miles from where we lived,1
212,I would rather pick my food up from the kitchen myself and fill my own drinks than deal with tipping.,1
22,The tail on this squirrel.,1
12,I just achieved multimillionaire status but I can't tell anybody IRL,1
362,too much sympathy?,1
172,Update..,1
195,Some trains in the Czech Republic have in-built bottle openers for passengers.,1
239,"What if Nemo had glasses, would have been found sooner ?",1
33,The foam in my pint created a duck,1
130,A hemp plant sprouted outside my workplace randomly.,1
226,To the people who apologise for English not being their first language at the start of posts,1
140,These dual lighthouses on Lake Michigan.,1
296,Smoking weed might help...,1
84,This building has curtains on the outside,1
22,The door people at my nearest Burger King also need to pee,1
127,A touristy town in Taiwan has street signs pointing to every hotel,1
129,Oldest container plant in the World,1
178,heart shapes on one side of my tomato but not the other side.,1
205,Gf has semi nudes saved in snapchat's chat with other guys,1
149,My yellow onion with a red onion streak,1
227,Advice on being social and making friends (again)?,1
12,This uncut animal cracker,1
109,My smoothie straw was made out of agave,1
166,"A cockroach somehow laid eggs under the plastic film of this canvas, now they are trapped there",1
141,"Slime mold on a dead branch marked with beetle larva tracks. NW Tasmania, Australia.",1
46,This uncut piece of spaghetti,1
