,title,verdict
205,A Sesame Street counting Reunion,1
61,This unopened Coke has sat in this busy parking lot for over a month,1
279,im sex addicted.,1
308,Random rant,1
278,these limited edition minion tic tacs,1
164,Plant looks like snail,1
6,frank ocean's iconic shirt,1
73,We all need to be a bit more like Mario,1
242,My tomato formed a smiley face,1
168,This fern plant tree growing from a chimney,1
250,Nipple fruit,1
23,The way a friend of mine just broke this glas,1
248,falling for someone who is non-monogamous,1
78,5th generation lobster fisherman is also birdbro,1
91,Water bottle froze right down the middle,1
222,This strawberry I found in my punnet,1
34,The sauce pattern on my pizza,1
152,Took the sticker off my red pear and looks like a green pear under,1
144,"[OC] Found this glass covered ballerina on a walk in the woods earlier this year, no houses nearby, no indication of who put it there or how long it'd been there...",1
0,I peeled a lime,1
33,is this really what normalcy is like?,1
297,My parents can't agree if I was an accident or not,1
127,my scoliosis makes my shoes wear extremely unevenly,1
158,I managed to capture the exact moment lightning struck near my house,1
195,Legendary seaman (OC),1
267,a letter to the first girl i ever liked.,1
300,step 2 of friendship(oc),1
96,the way the sun ate away this pool noodles coloring,1
34,Maybe Maybe Maybe,1
3,Accidentally touched a hot screw while pulling a pizza from the oven.,1
188,Only one branch on this tree has had leaves change.,1
96,this oddly straight cloudline this morning,1
158,Motherhood at its finest:),1
249,Fox being a foxy tease,1
10,Please unmute !!,1
234,This tree has a section of very bright leaves,1
25,My lamp gives my Wolfie beany baby “eyes”,1
258,Found my deceased grandmothers year book from 1942. Had a pretty graphic news article and memorial for a student.,1
132,The dents in the back of this truck look like a face,1
172,Accidentally made planet earth while making a plato meatball,1
253,Random pita chip mixed in with my bag of Cheez-it Grooves,1
134,Pringle’s stacked weirdly in small can.,1
141,You can see where my fingerprints started to form on the palm of my hand.,1
224,Somebody gently placed a piece of dog turd on my fence,1
286,"[OC] first day we brought our kitten home, my weiner is in love ♡",2
94,My friend and I gauge how good our day is by the number of Piñata’s in that day. The record is 3 for his birthday. Today he’s proposing to his girlfriend so I went shopping. It’s going to be a 10 Piñata day.,2
23,[OC] My Fiancé absolutely losing it over trick or treaters. She's lived rurally her whole life and this was her first Halloween in a suburb!,2
126,"I survived breast cancer, am moving out on my own for the first time and am up for a a new job!",2
269,"(OC) When hard work pays off!!!!! I just got off a call with my manger who said she requested an additional $1,200 bonus for me for all the amazing work I do. I am shocked, sleepy but still happy. Hard work truly pays off y’all 🙌🏻",2
104,(OC) my friends cat peachy Meester is Yoda for Halloween! look at this I'm dying! so cute!,2
175,I got to dress my grandson.,2
242,My childhood drawings came true :),2
51,"Gag gift from my aunt, after release from recent incarceration",2
236,[OC] Positivity in the bathroom stalls,2
267,TW! I finally made it and I feel so proud [OC],2
241,Such an awesome son💕,2
147,"Yes, I am 53, and yes this time of year makes me smile!",2
79,My sweet ratties and their paw paintings from this week - everyone did great!,2
275,Excited to get back home,2
72,"Week 7 of adopting him, I found him feeling very at home",2
151,I'm a 35 year old man and my mum still occasionally surprises me with penny sweets from the local sweet shop! Always puts a massive smile on my face! Forever a mummy's boy hahaha.,2
33,Husky acting as peacemaker..,2
282,Dad loves cat,2
121,"(OC) After 5 years of practice, and plenty of ups and downs, I have finally been promoted to 1st Poom!",2
77,I genuinely thought this was adorable.,2
20,One year liquor free,2
282,My amazing Gma turned 99 last week! If only we could all be this good at 99 years young! [OC],2
245,Everyone deserves a little fun once in awhile!,2
155,(OC) Forgot my keys and the neighbors cat came to me for cuddles while I waited,2
301,"My pup has been feeling a little neglected since we brought my son home when he was born. So today, I made him his favorite, leaf pile!",2
351,I'm so proud of myself [TW SUICIDE],2
38,Yesterday was my 2nd anniversary with my husband. I can’t help but grin when I see this pic from our wedding celebration. His smile is infectious. [OC],2
203,I have a new favorite video,2
2,"Update: 75 lbs lost since I last posted, 125 lbs total! (OC)",2
91,The kindness and generosity at our baby shower. This kid’s getting so much cool stuff! Plus like a million diapers!,2
209,You look nice! ...,2
157,"This boi, home from the shelter less than 24 hours; this is his favorite sleeping position",2
99,This is wholesome af,2
6,i said yes!! (OC) 10/30/22,2
261,"My new girlfriend visited me for the first time while ago, and my dog that normally takes some time to warm up to people is absolutely smitten",2
76,Love this!,2
217,shoutout to black people,2
66,Finally plucked up the courage and ended things with my manipulative ex.,2
83,(OC) Need a smile? Here's goofy doggo pics.,2
204,A student of mine helped arrange my papers today,2
15,I passed my learners test!,2
70,[OC] my cat cuddling up to me after a long day made me smile,2
55,Gave me a chuckle 🤭,2
106,[OC] Staffordshire Bull Terrier drawing. Look at that smile.,2
215,Two Polar Bear Cubs working hard to keep up with mom!,2
207,Cuddling a miniature horse,2
19,"[OC] When I wean a baby at 1 year old I go away for a Weanebration to commemorate the end of all the hard work of pregnancy and nursing, and celebrate having my body to myself again. 10/10 would recommend for all moms!",2
52,Birthday Surprise for adopted Boy by his new family.,2
60,so generous,2
68,Extra smiles on this one :),2
294,A real life hero,2
288,Making everyone around him smile... even me!,2
76,Rapper Rod Wave ran into his fan listening to his music,2
46,(OC) Spending time with my dad makes me smile. 2 years ago he survived heart surgery. So thankful to still have him in my life.,2
178,"He will NOT go to sleep without his pet giraffe, Jerry. He was so sleepy, but he wouldn't give up, even after 10+ minutes of searching every nook and cranny of the room. He uses Jerry as a pillow",2
229,(OC) Gorgeous scenery I got to capture,2
0,"I have been so depressed at my job and can afford to quit for a couple months, I'm so relieved.",2
210,i get letters like these every other week from my granny i love her so much,2
285,My boyfriend is the hottest guy I have ever seen,2
273,[OC] We used to party together and now were all sober celebrating my buddy getting married next month sober,2
74,My parents front yard. I live in the city and coming home is always peaceful.,2
300,25 M going to try and change my life,2
103,This morning my I picked up my daughter and she gave me this big hug for at least 5 minutes. We just stood there and hugged and my wife took this photo of us,2
63,Taste testing ingredients for her 22nd birthday cake in less than a fortnight's time :),2
294,There is still good left in humanity,2
24,"The inside corners in this IKEA KLIPSK bed tray match perfectly the radius of the MacBook Pro 14""",2
146,How could you say no to that cute little face 🥰,2
281,[oc] my wife turned my favorite movie into a sick Halloween costume. Still the best Halloween I've had.,2
225,(OC) My GF first drawing at her dreamed university she is attending. Im so proud of her! And wanted to share It with you.,2
283,So sweet,2
173,Nom Noms & silly faces in the garden :),2
109,in light of the post yesterday about losing weight here is my progression 250 to 155,2
298,My Girlfriend came out as Asexual and now I like her more,2
119,Watching my 13 year old introduce my 2 year old to the wonders of Mario Kart 64.,2
75,[OC] My sweet little dog,2
145,Fall leaves make me smile 😊 🤙 [OC],2
40,"After several years of being extremely overweight (closer to obese) I finally asked for medical help losing weight, and it’s really happening. And… NO DIABETES!!! 🎉",2
211,men are so hot,2
166,My local Zoo provides pumpkin carving templates of the animals they have in their care every year before Halloween. As an adult I still get extremely excited when they are released. What’s your favorite?,2
49,My sweet elderly rescue taught my daughter how to sit. So now she sits like this....,2
202,Worlds most adorable police chase,2
33,Good dad :),2
56,Mad respect for Mr. Harrison,2
174,my partner loves me for who i am!,2
239,100 days sober! (OC),2
277,I had a major surgery a year ago surrounding my head/brain October 5th 2021 today I'm still going on strong and waiting for another (OC),2
217,Uplifting,2
9,Well done Champ👏🏼 She is the first redhead to win the Title in Miss England's 94-year history.,2
177,I like someone from my group therapy at school,2
199,I actually enjoy home ec in high school.,2
141,"My friends and i went to a medieval ren faire event we've been waiting for for sometime, some of us dressed as our D&D characters and it was amazing =D",2
143,Glad that my best friend unfriended me,2
317,i love my job and my coworkers,2
222,Dairy cows sees grass for the first time after 6 months.,2
48,What a lucky stepson!,2
39,7 Eleven owners helping school kids during the pandemic,2
246,[OC] My 7yo daughters art was selected to displayed permanently at our cities ASPCA animal shelter. It’s to be hung in there reading room where children can read to the animals.,2
193,"My daughter donating her hair to cancer patients, so proud.",2
34,i love my boobs.,2
80,Dad gets excited to shop for his daughter's first winter/Christmas.,2
240,Mam left her cosy fleece on the bed the other night and it's now been gifted it to Molly because she loves it so much ❤️,2
36,It's my cake day. Help yourself.,2
136,My cats posing for no reason. Enjoy!,2
89,Artist takes care of a fan! (OC),2
30,Earned my Gold GAFPB (German Armed Forces Proficiency Badge) today! One of the hardest foreign awards to receive!,2
186,To my love. Just trying to put my feelings to words,2
194,"(OC) MSc complete....made it through 4x covid, a full time caring job and loosing my uncle - I did it!!!.Next stop Doctorate 🙌🏻",2
132,I’ve been obsessed with Wendi McLendon-Covey since the Reno 911 Days🥹💕 Her Retweet has Made My Day!! (OC),2
231,Cat mommy introduces her kittens to her human mom,2
98,A relaxing steam room,2
392,"My father made a small considerate gesture for me, and it made me cry",2
260,"We saw, we loved, we're bringing him home... ""Karter"" aka ""Baby Kitty V""",2
58,(OC) My dog enjoying autumn,2
254,Never Give Up!!,2
14,She started new business and all her friends came on 1st day to support her without the invitation.,2
207,I love you Dad,2
224,I may have found my happy ever after,2
29,The tail wiggling when she kisses!,2
227,This Tibetan rug is over 125 years old but the colors of the thread have faded so much that this prominent smiley face was slowly created! :) Saw it in a shop this week [OC],2
36,I'm sick and tired but I love my girlfriend so much,2
56,"today I am officially 2 years sober, SH clean and maniversary! I celebrated with baking cake.",2
24,"[OC] Today is my 22nd birthday! I’m a student teacher, so I decided to get some little squishy fidget toys for my 4th grade students :)",2
35,that's an absolute win,2
296,Students and staff at an Oklahoma elementary school lined the hallways to cheer for their school cafeteria manager who passed her test to become a U.S. citizen,2
194,"My horse's ""happy sound"" :)",2
171,My adorable pet rat Blueberry practicing some advanced fetch (fetch + obstacles)!,2
53,(OC) After 2 years of self dejection towards my future and a painful amount of support from my partner. I finally got accepted into a graduate program.,2
50,The love of my life and the newest member of our family,2
165,Helped others smile,2
301,This doggo keeps this family's son safe by constantly checking up on him.,2
218,My daughter's first time getting to watch me compete and I felt like first place of the world.,2
278,"My wife (who in 10 years, I’ve never known to be very artistic) just busted out this illustration assignment for a grad class.",2
242,Mini portfolio of mine over that last year! Very happy with how much I improved! (OC),2
18,"On the verge of her death, I found her starving in the streets. It's been 2 months and she is now a healthy cat running around the house. I named her Luffy.",2
103,My dog Sadie brought a lot of smiles to strangers yesterday [oc],2
262,"At Tokyo Disney with this amazing man, and if we weren't already married I would ask him to be my best friend forever more. stay happy peeps 💞 [OC]",2
292,Probably The Cutest Thing You Will Ever See.,2
158,[OC] A little kitty drawn by my local barrista on my bagel bag! Day made!,2
149,I keep seeing cat homes in Malta for the local stray cats. Never seen anything like them before and it made me smile :),2
122,Seeing this really made me smile. Hope it does the same for you as well!,2
290,"A very good friend, as usual, likes to visit in the evenings.",2
110,Little boy gets a prosthetic arm.,2
117,"A childhood goal was to handout full size bars, and today I got this!",2
276,Loved this reunion between Lecter and Clarice!,2
162,[OC] I hope these adorable floppy ears make you smile today,2
0,I just got into medical school!!,2
111,Sweet little girl surprised by returning soldier father,2
114,"[OC] Does anyone else love tiny things? My husband grew his first butternut squash plant this summer, and this is half of the crop.",2
64,I just adore this photo & have been trying to find name of photographer who took it,2
28,"After being sick for 2 months straight, I finally got the strength to go to the park. First time on a swing in years. It's nice to feel alive again.",2
26,Grandpa's greatest build,2
97,"The look on my grandmas face when she got the new phone we sent her is amazing (she lives far away and could not afford a new one, hers was very old) (OC)",2
298,(OC) I lost my 14-year old dog in August but I get to bring home this smiling girl next week! 🤍,2
253,The happiness to see her wheels about to get out on.,2
140,Problem solved!,2
214,Met My Online Friend Of 2 Years In Person And Recently Became A Couple 💜,2
259,[OC] 🐶🐾 happy GOTCHA day to the most bonkers dog on the planet 🌏💙,2
81,"Four years ago, Dr Jess Wade wanted to encourage young girls to pursue careers in STEM, so she started writing Wikipedia biographies of female scientists who weren't being written about. So far, she's written more than 1,600 biographies.",2
125,It gets more beautiful the longer it goes,2
226,Spreading the joy of laughter,2
141,How happy this included child’s costume makes him. Gives new meaning to Shark Tank!,2
299,Child overjoyed for getting a prosthetic arm,2
269,I cried for an hour today because I feel so happy,2
58,Best football play of the year,2
95,Adorable.,2
189,I put a funny wig on a Halloween skeleton and now our cats think it's one of us humans,2
257,“I won’t be a rock star. I’ll be a legend.” Freddie Mercury I hope you all enjoy my son’s Halloween costume from last year. Too good not to share! (OC),2
190,Making a lot of people smile!,2
184,The sheer happiness of this fox.,2
284,My awesome ratties Butter (dwarf) and Donut (standard) playing vs basketball together!,2
87,every year I grow our pumpkin let my daughter pick a theme and I give it a go. I'm pretty happy with Batty ✌️,2
108,"[OC] I turned 16 today!!! (Left is toddler me, Right is 16 yr old me)",2
186,A very excited bird bouncing golf balls,2
235,[OC] Kids from my village can’t contain themselves after hearing I’m back,2
4,"To the person that came into my work yesterday, I hope you're doing okay.",2
182,I found out in July that Metallica was going to be playing near where I live and got tickets to see them in August. The first concert I'd ever gone to by myself but easily one of the best decisions I've made,2
127,"I have a paralizing fear of heights. 10 years of hiking later with my courageous wife, this is the closest I can get to a 2000 foot drop. Old fear conquered for a blustery 20mph, chilling 28°F shot.",2
102,The truck in front of us lined up perfectly with the mountains!,2
43,"My acne scarring has always made me feel self conscious about taking pictures, I’ve been feeling good lately especially in this selfie! (OC)",2
21,"After years of staying in a toxic household, I packed my stuff in 3 bags and left. Rent is gonna stretch my paltry salary but the mental health and relief makes it worth it. Fingers crossed!",2
53,"My mom took my daughter fishing off of the skyway bridge, and she caught her first fish.",2
45,i found out my crush liked me back and now i wanna cry my eyes out,2
183,Excited chicken hops,2
124,I never thought I’d be so happy and here we are celebrating our ONE YEAR ANNIVERSARY!!,2
17,(OC) 11 years clean,2
137,Snuggling up to a new family member,2
228,(OC) My wife and son having the sweetest moment before bed,2
202,Happy Halloween everyone (OC),2
301,Don't give up! You can do it!,2
3,(OC) I brushed my teeth for 22 days in a row!!!!!! 🥹🫧,2
229,Just noticed I’ll be 2 years clean from SH in less than 100 days. It’ll be the longest I’ve ever been clean. I’m so proud of myself 🥹 (OC),2
35,Little kid gets a free piano lesson from a stranger,2
299,"Enjoy your day, just like he does",2
295,Elephant excited around a drum,2
212,Giving love and treats to street dogs in Albania,2
63,My bread bowl had a face. Kinda neat,2
239,I love my family,2
62,"[OC] Smiling pic of sun, credit NASA",2
163,Our cat is welcoming two new family members (OC),2
298,This dog has been on Halloween countdown since the start of the month.,2
272,[OC] We made a big leap and decided to travel full time in our RV! This is from our first adventure,2
121,"Taught him rollover, bow, weave, and I couldn't teach him to paw. After 8 weeks of adoption, we finally got it!",2
1,The broken lock on the bathroom stall still swung around to work perfectly,2
157,"After almost a year of near-constant anxiety, I finally calmed down long enough to make this: the world’s jankiest music video! It’s my first ever animation and I’m kinda proud honestly",2
211,My FIRST ever monitor!! Yay :),2
65,This adorable parenting moment,2
216,"This random, sweet text I received from my dad today.",2
243,Thoughtful comment “now you’re just beautiful” made this lady’s day! (OC),2
20,ive been blessed with the foretold 'folded pringle',2
5,Heroes are all around us!,2
255,This is beyond sweet!,2
172,(OC) I saved this little bird's life today!,2
264,Me 20 years ago loving painting vs me now trying to make a career out of it and still loving it :) (OC),2
278,I (32F) like to watch my boyfriend (28M) sleep.,2
44,This wholesome couple,2
263,"On my train ride back home, two girls made my portrait and handed it to me before exiting",2
124,[OC] Nothing makes me happier than how much my little girl and her grandpa love each other. We joke if she runs away we can find her with Grandpa.,2
93,"Baby’s first laugh makes the mama cry, what a bundle of Joy..",2
297,Our with the dog and walking on a gloriously thick carpet of beautiful leaves. Looking at them I realized I'm happy in this moment. (OC),2
39,"[OC] 4 years sober today. Feeling healthy in the present, found compassion in my past, looking forward to writing the chapters towards my future.",2
87,[OC] my heart melted when I saw them like that..🥰,2
96,Beautiful stuff,2
154,This thread really made my day,2
165,After being told I couldn't draw I made sure I kept drawing and following my passion. I'm really happy with where I'm at now [OC].,2
266,[OC] a sweet little girl left this at a restaurant I worked at,2
287,My kid won the “Respect” award at her school,2
70,My fur babies love my new baby,2
77,Cute and lovely moment!!!,2
157,i think i have a crush :),2
300,our babies first laugh at 5 weeks old,2
92,"(OC) Son and I flew 4,000 miles to surprise Grandma!",2
259,"Got to hear baby's heart beat for the first time! 18 weeks, 2 weeks until we find out gender!",2
37,I offered free cleaning but she paid me $100,2
273,This man sharing a meal with his pet mouse,2
5,"Maybe this is the meaning of living in life. After many years, I found the video. It felt so good that I couldn't hold myself to sharing it on my favorite subreddit.",2
226,"Scored last minute tix to see him live, ended up enjoying the night with my Lyft driver. (I was not a “Posty” fan until now). Dude is an incredible performer.",2
86,today is my dog's birthday. we dont know how old he is but we celebrated with a burger just for him! (ps i couldnt find a candle so he gets an unbrella instead),2
44,"After campaigning relentlessly for a chinchilla, my young daughter gave me a big hug as she got on the school bus. Later that day, after running errands, this fell off my back.",2
251,Got lucky with this photo of my baby (OC),2
102,Pure happiness [oc],2
182,Halloween cuteness.. 🎃,2
65,You only turn one once!,2
99,"[OC] So I’d been going to this hike/trek for years. Every season, I’d meet the same dog, bigger than the previous season. He learned many things over the years, handshake being one. He’s always been a good boi.",2
108,Cool double rainbow,2
267,"(OC) 1 have a younger sister and she has always been using my old phones or my dads or mumma's. She turned 21 this year, and had been asking for a good phone for years. I unfortunately couldn't be home but my parents surprised her with this iPhone and seeing the reaction I had tears in my eyes.",2
59,I love my husband,2
166,This couple just being a wholesome couple,2
368,I'm choosing myself and I'm choosing life,2
129,Playing Garou Mark of the Wolves with my 4-year-old - so happy she loves fighting games of my time!,2
183,Feeling immense guilt and pain over my birds sudden death today.,0
146,My brother is horrible,0
47,Indian College Rumors Destroying My Confidence,0
55,I resent my boyfriend (TW),0
361,I Hate 4c Hair,0
300,My mother and brother are depressed,0
259,I acidently killed a little lizard and i hate myself,0
246,messed up letting a homeless friend move in with me,0
302,I feel bad charging people for counseling,0
165,"Feel constantly angry, and regularly checking in on abusers. How do i stop (TW)",0
5,I fantasize about killing,0
297,Nobody notices my progress,0
18,I have ruined my entire life before its even started,0
70,How long do I have to tolerate this...,0
90,My friends kinda suck,0
112,I am extremely depressed over missing out on superficial social endeavors 3 years ago,0
245,"Singleness still hurts, and I'm not sure when it won't",0
57,I loath GROUP PROJECTS!!!!,0
148,my friends are fucking pathetic,0
226,My father comes to My Home only yo criticize me fornlittle things and I feel Bad because I confronted him,0
254,Incompetend goat tries to hurt doggo,0
316,"I hate my grandma, I cant live with her.",0
173,I feel like I’m loosing my best friend to her bf,0
24,Growing up poor really fucking sucked.,0
307,Pregnant and broken,0
209,Being white and feeling guilty over slavery,0
29,Loneliness as a girl,0
262,I've felt like a burden on my parents for the longest time.,0
68,An Online relationship/fling left me in a mental pit.,0
72,I want to kms but i feel to guilty too,0
192,I am honestly very done with things.,0
61,Im afraid to be in my relationship (TW: Suicide),0
264,"im stupid, and hates when people just make me feel ashame of it.",0
253,Giving up!,0
19,I just need to vent.,0
69,"My Boyfriend (M30), said this to me and I'm heartbroken over it;",0
77,This is stupid but I feel really really bad for not talking to someone I was meant to look after,0
86,I hate that I just signed a one-year lease on a dingy oldplace with crusty walls,0
169,People find me a threat and an aggressive person. I'm so sick of this,0
7,Being an Unattractive Young Woman is Horrible,0
58,I killed the girl that murdered my girlfriend to be with me,0
254,I feel like my sexuality/identity has been corrupted by growing up on the internet,0
236,I'm scared to make friends and other issues,0
197,I feel like I lost the greatest girl ever due to overconfidence,0
8,I feel like dying right here right now,0
132,It's been a rough year,0
56,"I hate my roommate after she called me ""easy""",0
320,I feel that my sister is using me,0
145,I feel awful about my dating preferences,0
308,I really wish my parents stopped romanticizing the unsafe shit that happened in their childhoods.,0
41,I feel pretty empty,0
373,I'm bad at everything,0
76,I hurt people I care about because of my apathy,0
163,I used to foster stray cats. Last Sunday I abandoned my cat in a park. The guilt is killing me,0
77,I HATE YOU DAD,0
92,I have obsessive thoughts,0
256,I'm scared I'll end up killing myself.,0
162,I think my boyfriend is starting to hate me,0
112,is there medication to help an overthinking brain shut up?,0
19,I don't think I'm okay being the other guy,0
194,had my headphones stolen and my phone,0
242,I hate being married to my wife. I'm going to divorce her.,0
78,My worst birthday,0
382,Capstone senior project and I’m tired with working with lazy people.,0
105,I lost friendships over a discussion about bodyshaming,0
21,I might get in trouble with the school!,0
94,being chronically suicidal is so isolating,0
