,title,verdict
114,"My Mom promised she wouldn't punish me, but she lied and I'm devastated",0
299,Why do I always have to be alone,0
125,i’m always told i’m beautiful but deep down i feel so ugly.,0
251,my bf cheated on me and insisted on gaslighting me,0
140,Feeling like a failure and I wanna hurt myself,0
13,My mom forced me into a codependent relationship because her mom left,0
196,depression and social anxiety is not a good combo,0
87,I got scammed and feel like an idiot,0
167,my birthday comes back again to ruin my month,0
3,I am missing out on my life and I hate it,0
223,I made the mistake of googling the zoo,0
264,I almost got raped,0
218,promoter tries coercing us and threatens to call the cops on us,0
14,"Im so scared of being lonely again , i cant stop being a people pleaser",0
234,i feel completely defeated and tired.,0
346,"help, please. I don't know if I should move out of my passive-aggressive family members' house.",0
311,i had my phone stolen and was threatened yesterday and it shook me up,0
289,Scared of the rest of my life,0
298,I hate feeling inadequate because of my body,0
377,My first love is a predator(NSFW?),0
232,I'm ashamed of being Brazilian,0
199,"I despise the word ""simp""",0
124,I think I hate my mom,0
130,Transphobes Are Disgusting. Fuck you.,0
179,I can't confide in my boyfriend anymore,0
294,Im a fuckup.,0
133,I felt attracted to my parents' friend who is old enough to be my dad (30 years older),0
154,I regret not continuing my interests.,0
205,I'm sick of feeling like no one wants to get to know me!!!,0
185,TW - I deserve to feel depressed and suicidal,0
113,To the people who bring their babies on night buses: fuck you.,0
146,"The means to an end that eats me up day by day, and the present feeling",0
268,I k!liked my cat,0
216,My friends make me cry every night.,0
48,"I'm embarrassed because I had to poop in my college dorm trashcan, now I want to go home.",0
197,I do have killing tendencies.,0
101,I hate being white.,0
388,I asked my girlfriend for help and now I feel bad about myself,0
327,I don’t see the point of being alive right now in my life.,0
183,"friend mad at me, but she's overly petty",0
331,"Really want to email a former professor, but I didn't do super well in her class, and I'm afraid she wouldn't want to talk to me.",0
89,I've been unemployed for half a year and I can't take it anymore,0
105,I have a nuclear option for dealing with my abusive mom that would mentally destroy her side of the family.,0
110,"I fucked up, I lied.",0
143,My mother once again refuses to take responsibility for her actions,0
61,I don't mind the fact that my friend isn't supporting me but the fact that he is lying about it.,0
96,my grandfather molested me and i can’t tell anyone about it,0
290,I resent my family.,0
274,The mirror at the end killed me,0
10,I've had to turn down a deal that would have changed my life,0
140,i get bullied and im suicidal again,0
94,Extremely Depressed and... Losing My Mind? (27M),0
104,I wish I was a man sometimes and it sucks,0
249,You have destroyed me.,0
15,I have lost interest in all my hobbies.,0
28,The silence killed my emotions and now I feel nothing,0
11,A dream taught me that being maidenless sucks,0
272,"thinking bout just killing myself tonight, fix issues for everyone",0
168,Very close friend betrayed me,0
276,"Losing my (ex) boyfriend, my partner, my best friend.",0
14,People are horrible and I want to give up,0
274,I ruined my reputation at church,0
225,I hate being the smart kid,0
50,I’m overstimulated by sexual imagery and unrealistic beauty standards in media to the point of sex repulsion.,0
136,I just want to love and be loved but all men want from me is sex.,0
44,I'm going to run away tonight,0
308,I’m super embarrassed,0
27,I'm being pushed too harshly,0
141,My friends keep hanging out without me and i feel like shit,0
380,I hate my husband,0
132,Too much people passed away in less than 3 months I feel like losing my mind,0
227,idk why this got me so upset,0
396,I am extremely and unhealthily aroused by the idea of my death,0
155,Just a lost teenager ranting about some sorrows,0
62,I hate my life after having a baby,0
238,im scared going in my kitchen.,0
118,Im so annoyed right now,0
270,"I might have an issue, but my mom refuses to acknowledge it even though something is clearly wrong",0
282,I hate myself because of my ethnicity.,0
79,I felt sad reading about guys being left on read,0
116,I hate my school rules,0
342,i hate my drunk mom,0
13,I don't want my father to have another kid,0
4,I wish I did not have any relation with anyone. (Friends/GF/Family),0
21,I hate having grown up autistic,0
212,School is going to ruin my life,0
16,Was dumped by my boyfriend and I feel dead inside.,0
192,Im scared.,0
277,I'm going to fuckin kill myself,0
130,my dad would stop seeing his own kids to save money ..,0
40,this shit is becoming too difficult,0
266,My dad died on the streets after the hospital kicked him out for not dying fast enough,0
225,i hate myself right now cause I mad a mistake,0
73,I broke up with my boyfriend because he is in the middle of a mental health crisis and I hate myself now.,0
164,I feel like I’ll never be good enough,0
275,I (5'1F) don't feel attractive because of my height.,0
170,I basically stopped eating to lose a lot of weight and all anyone does is compliment me,0
72,28 and hate my life,0
39,i feel bad about not struggling financially.,0
237,I hate talking about martial arts!,0
169,i wish someone told me when you cry enough it losses its value,0
41,My sister abuses her husband,0
277,I can't stop pulling out my hair.,0
303,I am about to lose it! 🤬🤬🤬,0
290,I've had IT with my job.,0
78,I miss my girlfriend so much that I don't know what to do and im so lost.,0
46,I am so angry all the time and I hate it,0
80,im just so angry recently,0
47,My life has been a series of upsetting events and I need to vent,0
109,i am not doing even remotely okay,0
134,My brother is destroying our house.,0
256,Losing the last reason to be alive,0
40,no one has ever loved me.,0
267,I potentially ruined her life,0
180,I’m terrified of becoming like my father,0
120,Worst week ever,0
111,Writing a best man speech hurts me,0
180,Alone again,0
40,My cousins hookup made some weird comments about me and I don't know how to feel.,0
279,i hate my boyfriends kid,0
31,I was mean to my friend who committed suicide,0
216,Loneliness makes me feel like im being stabbed by nothing,0
70,the thought of marriage scares the living crap out of me,0
207,It confuses me when ppl are upset about shows,0
161,Desperately,0
184,I was addicted to Fentanyl,0
250,"I caused my friend to lose his GF, then kill himself [Trigger: Suicide]",0
9,Dad tried killing himself i am lost.,0
343,Girlfriend left me and I realized how alone I am,0
12,i hate my brother because i hate myself,0
210,I hate the way I am due to my trauma,0
324,I'm soo fucking tired of seeing and hearing transphobia every single day.,0
187,I'm a fucking failure,0
220,"I am so anxious, I’d do anything to get out of this.",0
301,Stressed that submitting late assignments won't get any marks and I won't pass and graduate this year.,0
204,Just got called ugly. Realized why it stung,0
303,My mental state isn't okay I think,0
153,Feel insecure in my relationship because of my lack of experience,0
263,A girl i kissed said i forced myself on her and its killing me with guilt,0
376,Why did you hit me?,0
46,"Ivete been giving emotional support for people my entire life, and no one ever gave emotional support to me.",0
88,I get jealous when I see people with amazing supportive parents,0
236,I failed,0
20,"Was broken up with a few weeks ago, i just feel dead inside.",0
39,"My mom said to me: 'Every time I come home, I hold my breath, expecting to find you dead'",0
177,"TW S/A For 3~4 years, I (22F) was regularly r*ped by the same man",0
97,Saw messed up stuff on twitter and feel depressed,0
276,I fucked up at church,0
257,"When I get stressed, I go in my car and go.",0
73,i think my fiancé doesn’t love me anymore,0
279,I hate my my boyfriends uncircumcised dick..,0
318,I wish someone would notice that I really exist...,0
74,I'm scared to start dating again,0
92,I don't know what I can do anymore,0
174,im sad and cant move on,0
159,I don’t need you to be happy,0
127,"Doesn't it just suck loosing someone, (relationship wise )",0
323,were not meant to be together,0
393,Got terminated today.,0
335,I was sexually assaulted by my dance teacher,0
105,"I constantly feel anxious in my relationship, even though things have improved in the last few months.",0
306,Im scared,0
306,I hate my generation (Gen Z),0
199,disappointed,0
17,Angry.....I'm very angry,0
198,I'm having the opportunity of a lifetime and I kind-of hate it,0
107,My life is in shambles &amp; I don't know much longer I can keep going.,0
34,Hard to deal with girlfriends' 3-year-old son and girlfriends' frustration.,0
97,my cousin stole my late father's guitars and acts like I'm the one who did him dirty,0
163,"Head hurts, feeling heavy and tired. Should I call out?",0
98,I feel like I'm an idiot,0
213,I talked to women who just got out of prison and I was horrified,0
142,6 months TTC Blues,0
264,I hate my relationship,0
284,"I hate Gen Z, here's why",0
75,"I've made a decision that will quite possibly be my most self destructive yet, and I'm determined to see it through.",0
214,I am so withdrawn from my co workers,0
69,I hate anxiety,0
349,Math makes me suicidal,0
74,I'm a lesbian but I'm too afraid to tell anyone,0
175,I'm not enough. and I don't think that I ever will be.,0
109,TW: SA My ex who was an adult when I was a senior in high school convinced me not to make him use condoms and looking back makes me feel violated.,0
219,I've been writing down all my depressive thoughts for the past 2/3 months and feel like someone should read them,0
